Best Sellers Rank,Net Quantity,Product Dimensions,name,price
#2009 in Grocery & Gourmet Foods ( See Top 100 in Grocery & Gourmet Foods ) #8 in Candies & Mints,46 count,,Mentos Rainbow Assorted Chewy Dragees Pouch 156.4g 46pc,₹ 50.00
#172 in Grocery & Gourmet Foods ( See Top 100 in Grocery & Gourmet Foods ) #1 in Candies & Mints,120 Tablets,3 x 1 x 5.5 cm; 200 Grams,Dabur Hajmola Tablet Anardana 120 Tablets,₹ 35.00
,,,GO DESi Popz Kaccha Aam- 10 Pieces 90 gm,₹ 50.00
#6113 in Grocery & Gourmet Foods ( See Top 100 in Grocery & Gourmet Foods ) #57 in Candies & Mints,420 gram,,Hoots Candy Combo Pack of Imli Candy & Chatpata Masala Candy Combined Weight 420gms,₹ 237.00
,,,Blomideal Tongue Cleaner | Scraper (Set-2)| Fresher Breath | Taste Enhancer | Surgical Grade Austenitic Steel Naturally Antibacterial and Durable for Life Long Fresh Breath and Oral Health (Sliver Strip Handle),₹ 196.00
#4853 in Grocery & Gourmet Foods ( See Top 100 in Grocery & Gourmet Foods ) #41 in Candies & Mints,54.6 gram,,Mentos Pure Fresh Gum Bottle Spearmint 54.6g,₹ 80.00
,,,Jiva Amla Chatpata Candy - 450 g (Pack of 1) | Boosts Immunity and Digestion,₹ 211.00
#1613 in Grocery & Gourmet Foods ( See Top 100 in Grocery & Gourmet Foods ) #4 in Candies & Mints,184.0 gram,,Alpenliebe Cream Fills Butter Toffee 184g (46 unitsx4g each),₹ 50.00
#3952 in Grocery & Gourmet Foods ( See Top 100 in Grocery & Gourmet Foods ) #31 in Candies & Mints,1000 gram,,D Bhar Dulal's Palm Candy (500 g x 2),₹ 160.00
#6257 in Grocery & Gourmet Foods ( See Top 100 in Grocery & Gourmet Foods ) #60 in Candies & Mints,42.0 gram,,Ice Breakers Coolmint Sugar Free Mints 42 g,₹ 142.00
,,,Organic Purify-Jelly Candy Chocolate Fruits Flavour- 400GM,₹ 179.00
,,,Tim Hawk Oral Dental C Cleaner Plastic Brush Scraper Standard(1696) - Pack of 2,None
,,,SoulGenie HealthAndYoga(TM) Superior Quality Copper Tongue Cleaner with Attractive Handy Grip | Superior Oral Hygiene,₹ 195.00
#7304 in Grocery & Gourmet Foods ( See Top 100 in Grocery & Gourmet Foods ) #75 in Candies & Mints,100 gram,,Aranyam Soft Ginger Chews Candy from North East 100g – Immunity Booster,₹ 310.00
,,,Wonder care -100% Copper Tongue Cleaner/Scapper Antimicrobial Ayurvedic Antibacterial scrapper for Optimal Oral Hygiene 12 Pack,₹ 349.00
#3332 in Grocery & Gourmet Foods ( See Top 100 in Grocery & Gourmet Foods ) #5 in Toffee #22 in Candies & Mints,1 count,,MAHAK Eclairs Candies Jar/ and Coconut Jar / Combo Pack of 2 jar / Chocolate Toffee / Milky / Coconut / Gift Pack(Eclair jar + Coconut jar) (Eclair jar + Coconut jar),₹ 345.00
#2109 in Grocery & Gourmet Foods ( See Top 100 in Grocery & Gourmet Foods ) #9 in Candies & Mints #45 in Chocolate,400.0 gram,13 x 13 x 4 cm; 400 Grams,GO DESi Popz Kaccha Aam- 40 Pieces 360 g,₹ 220.00
,,,GO DESi Imli Pop Tamarind & Jaggery Candy (50 Piece) 450 g,₹ 220.00
#3753 in Grocery & Gourmet Foods ( See Top 100 in Grocery & Gourmet Foods ) #27 in Candies & Mints,1120 gram,10 x 15 x 10 cm; 1.12 Kilograms,Ravalgaon Pan Pasand Gold Candy 560 Grams (Pack of 2),₹ 250.00
#5424 in Grocery & Gourmet Foods ( See Top 100 in Grocery & Gourmet Foods ) #46 in Candies & Mints,206 gram,3.8 x 9 x 18.2 cm; 206 Grams,Kraft Macroni and Cheese The Cheesiest 206g,₹ 233.00
#6291 in Grocery & Gourmet Foods ( See Top 100 in Grocery & Gourmet Foods ) #61 in Candies & Mints,900 gram,25 x 15 x 9 cm; 900 Grams,Mahak Kandiez Mint Chocon Candies / Mint / Mouth Fresh/ Mint and Choco (Pack of 1 Dispenser),None
,,,Wonder care - 2 pcs. 100% Copper Tongue Cleaner/Scaper Antimicrobial Ayurvedic cleaner Antibacterial scrapper for Optimal Oral Hygiene Combo Pack,₹ 349.00
,,,FRESH MELTZ Oral Hygiene Mouth Freshener Sugar Free Paan Flavoured Breath Strips (20 Strips) - Pack of 6,₹ 240.00
,,,CHAMRIA KARORPATI GOLI (anardana goli) 200GMS (2 PACKS OF CHURAN/PACHAK/ANAR GOLI),₹ 200.00
,,,SellBotic Tongue Cleaner Brush Scraper Set Of 4 pcs(multi colour),₹ 185.00
#2556 in Grocery & Gourmet Foods ( See Top 100 in Grocery & Gourmet Foods ) #3 in Toffee #13 in Candies & Mints #64 in Chocolate,330.0 gram,15.4 x 4 x 22.5 cm; 330 Grams,Cadbury Choclairs Gold Coffee (60 Candies) 330 g,₹ 116.00
,,,Colgate Vedshakti Mouth Protect Spray - 10gm,₹ 99.00
,,,nurpi soft plastic tongue cleaner pack of 2,₹ 279.00
#3872 in Grocery & Gourmet Foods ( See Top 100 in Grocery & Gourmet Foods ) #29 in Candies & Mints,180.0 gram,9 x 9 x 11 cm; 180 Grams,Nestle Fox's Crystal Clear Flavored Candy Tin - Fruits 180g,₹ 140.00
,,,Colgate Vedshakti Mouth Protect Spray - 10gm (Pack of 3),₹ 297.00
#6452 in Grocery & Gourmet Foods ( See Top 100 in Grocery & Gourmet Foods ) #64 in Candies & Mints,420 gram,,Hoots Candy Combo Pack of Mint Candy & Rose Peppermint Candy Combined Weight 420gms,₹ 237.00
#432 in Baby Products ( See Top 100 in Baby Products ) #7 in Baby Toothbrushes #18 in Breath Fresheners #35 in Manual Toothbrushes,1 U,3 x 1.5 x 20 cm; 20 Grams,Mee Mee Tender Tongue Cleaner Brush (Single Pack Orange),₹ 141.00
#3174 in Grocery & Gourmet Foods ( See Top 100 in Grocery & Gourmet Foods ) #19 in Candies & Mints,277.0 gram,,Parle 2 in 1 Eclairs 277g,₹ 50.00
,,,Spraymintt Mouth Freshener - Pack of 3 (Ice Mint),₹ 228.00
#6927 in Grocery & Gourmet Foods ( See Top 100 in Grocery & Gourmet Foods ) #54 in Chocolate Packets & Boxes #69 in Candies & Mints,432.0 gram,30 x 27 x 15.5 cm; 567 Grams,M&M's Milk Chocolate Candies Gift Pack- 36g (Pack of 12),₹ 599.00
,,,GO DESi POPz Candy Combo - Imli Pop (50 Pieces + 100 Pieces),₹ 720.00
,,,Rostaa Berrylicious Sweet and Delicious 200g (Gluten Free Non-GMO & Vegan),None
#4150 in Grocery & Gourmet Foods ( See Top 100 in Grocery & Gourmet Foods ) #34 in Candies & Mints,22 count,,Fisherman's Friend Sugar Free Mouth Freshener - Mint - Refreshing and Cool Lozenges 25g,₹ 89.00
#4216 in Grocery & Gourmet Foods ( See Top 100 in Grocery & Gourmet Foods ) #35 in Candies & Mints,420 gram,,New Tree Hoots Candy Combo Pack of Orange Candy & Pan Candy Combined Weight 420gms,₹ 237.00
